{
  "format": "tensor-investigation-bundle",
  "bindingVersion": "0.1.0-draft.1",
  "record": {
    "snapshotId": "urn:example:tensor:candidate:case-a:snapshot-1",
    "investigationId": "urn:example:tensor:candidate:case-a:investigation",
    "contractRef": {
      "proposal": "0.1.0",
      "bindingVersion": "0.1.0-draft.1",
      "status": "candidate; unratified"
    },
    "producer": {
      "label": "TENSOR synthetic fixture generator",
      "version": "0.1.0-draft.1",
      "implementationStatus": "Local candidate; synthetic events and actors"
    },
    "recordedAt": "2026-01-12T10:24:00Z",
    "scope": {
      "purpose": "Investigate a suspected restricted transfer by one agent job.",
      "subjectBoundary": [
        "urn:example:tensor:candidate:case-a:job"
      ]
    },
    "definitionReferences": [
      {
        "id": "urn:example:tensor:candidate:case-a:definition",
        "version": "0.1.0-draft.1",
        "sha256": "d24cc27aba68e7dff4d053bd7a65e9c6f5324f7286332913d5059794a52e2ff4",
        "artifact": "case-a.definition.json"
      }
    ],
    "dependencies": [],
    "entries": [
      {
        "id": "urn:example:tensor:candidate:case-a:actor-maya",
        "type": "Actor",
        "recordedAt": "2026-01-12T10:06:00Z",
        "attribution": {
          "actorId": "urn:example:tensor:candidate:case-a:actor-maya"
        },
        "kind": "human",
        "label": "Maya (synthetic)",
        "identityStatus": "selfDeclared"
      },
      {
        "id": "urn:example:tensor:candidate:case-a:policy",
        "type": "PolicyReference",
        "recordedAt": "2026-01-12T10:06:00Z",
        "attribution": {
          "actorId": "urn:example:tensor:candidate:case-a:actor-maya"
        },
        "policyIdentity": "urn:example:tensor:candidate:case-a:organization-export-policy",
        "version": "1.0-example",
        "effectiveTime": {
          "status": "known",
          "start": "2026-01-01T00:00:00Z"
        },
        "applicableScope": "The bound synthetic job and connector.",
        "locatorAbsentReason": "Synthetic policy; its conditions appear only in this example.",
        "conditions": "Ticket summaries are allowed. Attachment R is restricted. A designated incident lead may approve a scoped connector pause pending investigation."
      },
      {
        "id": "urn:example:tensor:candidate:case-a:authority",
        "type": "AuthorityAssertion",
        "recordedAt": "2026-01-12T10:06:00Z",
        "attribution": {
          "actorId": "urn:example:tensor:candidate:case-a:actor-maya"
        },
        "issuerId": "urn:example:tensor:candidate:case-a:actor-maya",
        "granteeId": "urn:example:tensor:candidate:case-a:actor-maya",
        "permittedOperation": "Approve a scoped connector pause",
        "scope": "urn:example:tensor:candidate:case-a:job",
        "validityStatus": {
          "status": "claimedValid",
          "reason": "Maya is asserted to be the designated incident lead in this synthetic scenario."
        },
        "basisReferences": [
          "urn:example:tensor:candidate:case-a:policy"
        ],
        "receiverLocalVerification": "notPerformed"
      },
      {
        "id": "urn:example:tensor:candidate:case-a:evidence-egress",
        "type": "EvidenceReference",
        "recordedAt": "2026-01-12T10:07:00Z",
        "attribution": {
          "actorId": "urn:example:tensor:candidate:case-a:actor-maya"
        },
        "description": "Synthetic correlated job and gateway logs without retained outbound payload.",
        "source": {
          "label": "Job runtime and egress gateway",
          "provenanceStatus": "asserted in synthetic scenario"
        },
        "availability": "unavailable",
        "locatorAbsentReason": "Source bytes are not distributed in this example; no actual evidence service exists."
      },
      {
        "id": "urn:example:tensor:candidate:case-a:observation-egress",
        "type": "Observation",
        "recordedAt": "2026-01-12T10:08:00Z",
        "attribution": {
          "actorId": "urn:example:tensor:candidate:case-a:actor-maya"
        },
        "statement": "The source bundle reports outbound bytes for this job and destination; it contains no retained payload.",
        "evidenceRefIds": [
          "urn:example:tensor:candidate:case-a:evidence-egress"
        ],
        "method": "Synthetic source-record correlation; not independently demonstrated here.",
        "eventTime": {
          "status": "bounded",
          "start": "2026-01-12T10:00:00Z",
          "end": "2026-01-12T10:05:00Z"
        }
      },
      {
        "id": "urn:example:tensor:candidate:case-a:instance-transfer",
        "type": "QuestionInstance",
        "recordedAt": "2026-01-12T10:08:00Z",
        "attribution": {
          "actorId": "urn:example:tensor:candidate:case-a:actor-maya"
        },
        "definitionRef": {
          "id": "urn:example:tensor:candidate:case-a:definition",
          "version": "0.1.0-draft.1",
          "sha256": "d24cc27aba68e7dff4d053bd7a65e9c6f5324f7286332913d5059794a52e2ff4",
          "artifact": "case-a.definition.json"
        },
        "questionId": "urn:example:tensor:candidate:case-a:question-transfer",
        "subjectBindings": {
          "subject": "urn:example:tensor:candidate:case-a:job"
        },
        "timeContext": {
          "status": "bounded",
          "start": "2026-01-12T10:00:00Z",
          "end": "2026-01-12T10:05:00Z"
        },
        "parameterBindings": {
          "subject": "urn:example:tensor:candidate:case-a:job",
          "window": {
            "status": "bounded",
            "start": "2026-01-12T10:00:00Z",
            "end": "2026-01-12T10:05:00Z"
          },
          "destination": "urn:example:tensor:candidate:case-a:processing-service"
        },
        "origin": {
          "kind": "entry",
          "rationale": "Monitoring reported outbound data for this bounded job."
        }
      },
      {
        "id": "urn:example:tensor:candidate:case-a:assessment-transfer-yes",
        "type": "Assessment",
        "recordedAt": "2026-01-12T10:09:00Z",
        "attribution": {
          "actorId": "urn:example:tensor:candidate:case-a:actor-maya"
        },
        "targetInstanceId": "urn:example:tensor:candidate:case-a:instance-transfer",
        "applicability": {
          "status": "applicable",
          "rationale": "Subject, interval, and required parameters are resolved."
        },
        "outcome": "yes",
        "rationale": "Correlated records support outbound transfer for this job; content and intent remain separate questions.",
        "inputs": [
          {
            "entryId": "urn:example:tensor:candidate:case-a:observation-egress",
            "role": "supports"
          }
        ],
        "method": "Evidence-linked synthetic assessment"
      },
      {
        "id": "urn:example:tensor:candidate:case-a:decision-open-content",
        "type": "Decision",
        "recordedAt": "2026-01-12T10:09:00Z",
        "attribution": {
          "actorId": "urn:example:tensor:candidate:case-a:actor-maya"
        },
        "targetInstanceId": "urn:example:tensor:candidate:case-a:instance-transfer",
        "selectedAssessmentId": "urn:example:tensor:candidate:case-a:assessment-transfer-yes",
        "disposition": "transition",
        "rationale": "Inspect content after the bounded outbound-transfer finding.",
        "policyStatus": {
          "status": "notApplicable"
        },
        "authorityStatus": {
          "status": "notApplicable"
        },
        "selections": [
          {
            "transitionId": "urn:example:tensor:candidate:case-a:transition-transfer-to-content",
            "targetInstanceId": "urn:example:tensor:candidate:case-a:instance-attachment"
          }
        ]
      },
      {
        "id": "urn:example:tensor:candidate:case-a:instance-attachment",
        "type": "QuestionInstance",
        "recordedAt": "2026-01-12T10:09:00Z",
        "attribution": {
          "actorId": "urn:example:tensor:candidate:case-a:actor-maya"
        },
        "definitionRef": {
          "id": "urn:example:tensor:candidate:case-a:definition",
          "version": "0.1.0-draft.1",
          "sha256": "d24cc27aba68e7dff4d053bd7a65e9c6f5324f7286332913d5059794a52e2ff4",
          "artifact": "case-a.definition.json"
        },
        "questionId": "urn:example:tensor:candidate:case-a:question-attachment",
        "subjectBindings": {
          "subject": "urn:example:tensor:candidate:case-a:job"
        },
        "timeContext": {
          "status": "bounded",
          "start": "2026-01-12T10:00:00Z",
          "end": "2026-01-12T10:05:00Z"
        },
        "parameterBindings": {
          "subject": "urn:example:tensor:candidate:case-a:job",
          "window": {
            "status": "bounded",
            "start": "2026-01-12T10:00:00Z",
            "end": "2026-01-12T10:05:00Z"
          },
          "destination": "urn:example:tensor:candidate:case-a:processing-service",
          "classificationPolicy": "urn:example:tensor:candidate:case-a:policy"
        },
        "origin": {
          "kind": "transition",
          "originDecisionId": "urn:example:tensor:candidate:case-a:decision-open-content",
          "rationale": "Selected yes transition from the transfer instance."
        }
      },
      {
        "id": "urn:example:tensor:candidate:case-a:hypothesis-restricted",
        "type": "Hypothesis",
        "recordedAt": "2026-01-12T10:09:00Z",
        "attribution": {
          "actorId": "urn:example:tensor:candidate:case-a:actor-maya"
        },
        "statement": "The transfer included restricted attachment R.",
        "relatedInstanceId": "urn:example:tensor:candidate:case-a:instance-attachment",
        "status": "proposed"
      },
      {
        "id": "urn:example:tensor:candidate:case-a:hypothesis-metadata",
        "type": "Hypothesis",
        "recordedAt": "2026-01-12T10:09:00Z",